{
  "schema_version": "1.0.0",
  "cve_id": "CVE-2025-66293",
  "bundle_id": "cc9e0287296e2e62",
  "nixpkgs_rev": "3ab61cef9c1730102c7ae32d4bde68fd78aaa53c",
  "builder_id": "trace-builder-v0.1.0",
  "host": {
    "system": "x86_64-linux",
    "nix_version": "nix-build (Determinate Nix 3.21.0) 2.34.6",
    "tool_version": "trace-cli/0.0.0"
  },
  "started_at": "2026-05-26T14:50:29Z",
  "ended_at": "2026-05-26T15:50:32Z",
  "patch_apply": {
    "applied": false,
    "git_apply_exit_code": null,
    "files_changed": [
      "package.nix"
    ],
    "post_apply_sha": null,
    "reason": "could not resolve package directory for attr='libpng' inside the nixpkgs checkout. Tried pkgs/by-name/<aa>/<attr>/ and nix eval --raw <checkout>#<attr>.meta.position; both returned no result."
  },
  "patched_build": {
    "applied": false,
    "outcome": "skipped",
    "exit_code": null,
    "drv_path": null,
    "out_path": null,
    "elapsed_seconds": null,
    "stdout_stderr": "",
    "stdout_stderr_log_sha256": null,
    "reason": "patch-apply-failed"
  },
  "unpatched": {
    "applied": true,
    "outcome": "timed-out",
    "exit_code": null,
    "drv_path": null,
    "out_path": null,
    "elapsed_seconds": 3600.012,
    "stdout_stderr": "\n",
    "stdout_stderr_log_sha256": null,
    "reason": "timeout"
  },
  "patched": {
    "applied": false,
    "outcome": "skipped",
    "exit_code": null,
    "drv_path": null,
    "out_path": null,
    "elapsed_seconds": null,
    "stdout_stderr": "",
    "stdout_stderr_log_sha256": null,
    "reason": "patch-apply-failed"
  },
  "passthru_tests_ground_truth": [],
  "sbom_delta_attempted": false,
  "dispatch_outcome": "patch-apply-failed",
  "instrumentation": null
}
